{
  "mission_id": "FMARS-C16-2024",
  "stations": ["FMARS"],
  "crew_designation": "Crew 16 (Arctic Wolves)",
  "institutional_or_volunteer": "volunteer",
  "start_date": "2024-07-01",
  "end_date": "2024-07-31",
  "location": "FMARS, Haynes Ridge, Devon Island, Nunavut, Canada (~75°25'N, 89°49'W)",
  "crew_size": 7,
  "source_citation": "SRC-hypatia-iii-brief, Appendix – Sources and notes: 'FMARS Crew 16 (Arctic Wolves) full reports (July 2024): daily reports by Michael Andrews (Logistics Officer), Commander reports by Ilaria Cinelli, EVA reports, Science reports, Expedition reports' (line 458). Crew size explicitly stated: 'Gray water container reached capacity with 7-person crew' (line 557) and 'applied sunscreen to all seven participants' (line 789). Mission timing corroborated by 'early July' framing (line 704, 292) and a daily report dated 05-07-2024 (line 472); departure noted as 'Day 11 via early morning charter window' after a 3-day weather delay in Resolute (lines 583-591).",
  "verified_by": "ASG"
}
